{
  "name": "Hero",
  "category": "organism",
  "purpose": "A large, responsive marketing banner at the top of a page, carrying a primary message (headline + intro + CTA) over an image or video, with an optional secondary message. Fully responsive across breakpoints with fixed- or full-height variants.",
  "props": [
    {
      "name": "breakpoint",
      "type": "enum",
      "values": [
        "xl",
        "m-l",
        "ms",
        "s-xs"
      ],
      "default": "m-l",
      "$note": "Responsive hero artboards: XL (scale-3), M & L (scale-2), MS (scale-1), S & XS (scale-1).", "binds": "scale", "$status": "s142-D1 (Dave, 2026-08-10) class C8 -- bind:ramp. breakpoint binds to the scale ramp per s141-D1(B) -- dimension + $extensions carries the breakpoint set verbatim; 'breakpoint' as a candidate address is rejected, scale is the ruled home. Record: reviews/BINDS-AUTHORING-VERDICTS-2026-08-10-s142-v3.json."},
    {
      "name": "height",
      "type": "enum",
      "values": [
        "fixed",
        "full"
      ],
      "default": "fixed", "$status": "s142-D1 (Dave, 2026-08-10) class C10 -- authoring-item:layout. no candidates; a layout-authoring item for a future lane. NOT authored here. EXCEPTION row. Record: reviews/BINDS-AUTHORING-VERDICTS-2026-08-10-s142-v3.json."},
    {
      "name": "asset",
      "type": "enum",
      "values": [
        "image",
        "video"
      ],
      "default": "image",
      "$note": "Background/secondary asset type."
    }
  ],
  "subComponents": {
    "primary-message": {
      "props": {
        "background": [
          "solid",
          "transparent",
          "none"
        ],
        "text-colour": [
          "dark",
          "light"
        ]
      },
      "note": "Also a '.Primary message with a corner' variant (hexagon corner)."
    },
    "secondary-message": {
      "props": {
        "asset-type": [
          "image",
          "video"
        ],
        "background": [
          "solid",
          "transparent"
        ],
        "text-colour": [
          "dark",
          "light"
        ]
      }
    },
    "assets": [
      "hero-image-fixed-height",
      "hero-image-full-height",
      "secondary-message-image"
    ]
  },
  "tokens": {
    "primary-heading": "text/default | text/reverse @ font-1/regular",
    "primary-intro": "font-4/light",
    "secondary-heading": "text/default | text/reverse @ font-3/regular",
    "body": "font-5/light",
    "cta-button": "primary/background/default (#DB0011) + text/reverse @ font-5/medium",
    "arrow-link": "color/primary + em-scaled flex-centred chevron (.85em, gap:4px) — legacy icon/arrow + padding/arrow retired 2026-07-17",
    "text-colour": "text/default (dark) / text/reverse + icon/default-reverse (light)",
    "solid-background": "primary/background/default (brand red)",
    "glass-background": "transparent surface (color/grey/transparent/white-75 or black-85) + background blur (radius blur/background-surface = 12)",
    "secondary-border": "border/subtle + border-width/small",
    "padding": "padding/responsive/medium (16), padding/responsive/xlarge (24)",
    "$finding": "(2026-06-20) BASELINE: text-on-surface only. The on-IMAGE variant (text/reverse over a photo + a guaranteed-contrast scrim) is FLAGGED — needs an image asset + scrim, a design decision."
  },
  "relationships": {
    "livesInside": [
      "Page (top)",
      "Landing page",
      "Marketing page"
    ],
    "mustNotNeighbour": [],
    "commonPatterns": [
      "page hero banner",
      "promotional masthead with CTA",
      "image/video hero with glass message panel"
    ]
  },
  "accessibility": {
    "heading": "REVIEW (inferred): hero headline is typically the page h1; ensure correct heading level",
    "textOverMedia": "Text over image/video must meet contrast — the solid/transparent message panel (with blur) exists to guarantee legible contrast over busy media; don't place text directly on uncontrolled imagery",
    "video": "REVIEW (inferred): background video must be pausable and must not autoplay audio; respect prefers-reduced-motion",
    "targetArea": "CTA button/links min 44px target",
    "relatedSC": [
      "1.4.3 Contrast (Minimum)",
      "1.3.1",
      "2.2.2 Pause, Stop, Hide",
      "2.3.3 Animation from Interactions",
      "2.4.6 Headings"
    ]
  },
  "antiPatterns": [
    "Placing message text directly over uncontrolled imagery without the solid/transparent (blurred) panel that guarantees contrast",
    "REVIEW (inferred): autoplaying background video with sound / no pause control",
    "Leaving message backgrounds bound to deprecated surface/transparent tokens — rebind to the live primitives/blur (see tokenValidation)"
  ],
  "tokenValidation": {
    "date": "2026-06-17",
    "against": "token store re-based on Figma native variable export",
    "result": "PASS (values resolve) — several deprecated surface/border + a legacy-namespace token; clean rebinds available",
    "newTokenGroupSeen": "blur/* (background blur for glass/transparent message panels) — live; first component to use it.",
    "depricateUsage": {
      "tokens": [
        {
          "token": "non-interactive (depricate)/surface/white",
          "value": "#FFFFFF",
          "rebind": "background/default"
        },
        {
          "token": "non-interactive (depricate)/surface/black",
          "value": "#000000",
          "rebind": "background/default (dark) / color/black"
        },
        {
          "token": "non-interactive (depricate)/surface/transparent/white",
          "value": "#FFFFFFBF",
          "rebind": "color/grey/transparent/white-75 (identical)"
        },
        {
          "token": "non-interactive (depricate)/surface/transparent/black",
          "value": "#000000D9",
          "rebind": "color/grey/transparent/black-85 (identical)"
        },
        {
          "token": "non-interactive (depricate)/border/on-light/neutral-3",
          "value": "#D7D8D6",
          "rebind": "border/subtle (identical)"
        },
        {
          "token": "non-interactive (depricate)/border/on-dark/neutral-6",
          "value": "#767676",
          "rebind": "REVIEW (no clean live border)"
        },
        {
          "token": "interactive (depricate)/on-dark/surface/brand-1/default",
          "value": "#DB0011",
          "rebind": "primary/background/default"
        },
        {
          "token": "interactive (depricate)/on-dark/border/brand-2/default",
          "value": "#FFFFFF",
          "rebind": "REVIEW (white border on dark)"
        }
      ],
      "legacyNamespace": "'Non-interactive/Content/On Light/colour-content-primary' (#333333) — an OLDER token namespace (not the 'depricate' suffix). Rebind to text/default. Flag: a second legacy naming scheme exists beyond the depricate set.",
      "auditedNodes": [
        ".Primary message 41367:34585",
        ".Secondary message 41367:34626"
      ]
    },
    "ignored": "specs/* annotation scaffolding."
  },
  "provenance": {
    "source": "figma",
    "figma_node": "Cgbtrmfp15ruNFkIAClpkI:41362:3440",
    "code_path": ""
  },
  "edges": {
    "renderedBy": [
      {
        "ref": "snippet:Hero.reference.html"
      }
    ],
    "usedInContext": [
      {
        "ref": "context:page-top",
        "$note": "Page (top)"
      },
      {
        "ref": "context:landing-page",
        "$note": "Landing page"
      },
      {
        "ref": "context:marketing-page",
        "$note": "Marketing page"
      }
    ],
    "commonPattern": [
      {
        "ref": "pattern:page-hero-banner"
      },
      {
        "ref": "pattern:promotional-masthead-with-cta"
      },
      {
        "ref": "pattern:image-video-hero-with-glass-message-panel"
      }
    ],
    "hasPart": [
      {
        "ref": null,
        "$note": "primary-message"
      },
      {
        "ref": null,
        "$note": "secondary-message"
      },
      {
        "ref": "component:hero",
        "$note": "assets: ['hero-image-fixed-height', 'hero-image-full-height', 'secondary-message-image']"
      }
    ]
  }
}